{
  "$schema": "http://json-schema.org/draft-07/schema#",
  "title": "Deen Coach Pack Manifest",
  "description": "Schéma générique d'un manifest de pack téléchargeable (toutes catégories : mushaf-fonts, audio-recitations, translations, tafsir, adhkar-audio, etc.).",
  "type": "object",
  "required": [
    "id",
    "category",
    "version",
    "displayName",
    "description",
    "url",
    "sizeCompressed",
    "sizeUncompressed",
    "sha256",
    "fileCount",
    "license",
    "publicationStatus",
    "minAppVersion"
  ],
  "properties": {
    "id": {
      "type": "string",
      "description": "Identifiant unique du pack en snake_case (ex: mushaf_qpc_v1, audio_husary_192kbps).",
      "pattern": "^[a-z0-9_]+$"
    },
    "category": {
      "type": "string",
      "description": "Pack category. The enum is the union of all categories already wired in the mobile app's pack registry. Adding a new value here REQUIRES a parallel change in the app's PackRemoteCatalog plus an entry in docs/CATEGORIES.md (status: active or reserved).",
      "enum": [
        "mushaf_font",
        "quran_audio",
        "quran_audio_learning",
        "quran_text",
        "quran_translation",
        "quran_tafsir",
        "quran_transliteration",
        "prayer_audio",
        "salah",
        "dua_audio",
        "asma_allah",
        "arabic_letters",
        "hifz"
      ]
    },
    "version": {
      "type": "string",
      "description": "Version SemVer du pack (MAJOR.MINOR.PATCH).",
      "pattern": "^\\d+\\.\\d+\\.\\d+$"
    },
    "displayName": {
      "$ref": "#/definitions/trilingual"
    },
    "description": {
      "$ref": "#/definitions/trilingual"
    },
    "url": {
      "type": "string",
      "format": "uri",
      "description": "URL HTTPS de l'artefact immuable à télécharger, typiquement une GitHub Release.",
      "pattern": "^https://"
    },
    "fallbackUrls": {
      "type": "array",
      "maxItems": 3,
      "uniqueItems": true,
      "description": "Copies byte-for-byte optionnelles de l'artefact principal. Chaque URL doit être explicitement validée contre le SHA-256 publié.",
      "items": {
        "type": "string",
        "format": "uri",
        "pattern": "^https://"
      }
    },
    "artifactFormat": {
      "type": "string",
      "description": "Format de l'artefact distribué. `raw` est réservé aux fichiers unitaires consommés directement par l'application ; `zip` est requis lorsqu'une extraction est nécessaire.",
      "enum": ["raw", "zip"]
    },
    "contentType": {
      "type": "string",
      "description": "Type MIME de l'artefact publié."
    },
    "sizeCompressed": {
      "type": "integer",
      "minimum": 1,
      "description": "Taille du ZIP en octets (utilisée par la modal de consentement avant download)."
    },
    "sizeUncompressed": {
      "type": "integer",
      "minimum": 1,
      "description": "Taille décompressée en octets (utilisée pour pré-check de l'espace disque)."
    },
    "sha256": {
      "type": "string",
      "description": "Hash SHA-256 hexadécimal du ZIP publié pour vérification d'intégrité post-download. Un manifest versionné dans ce registre ne peut jamais contenir de placeholder.",
      "pattern": "^[a-f0-9]{64}$"
    },
    "fileCount": {
      "type": "integer",
      "minimum": 1,
      "description": "Nombre de fichiers métier attendus après extraction. Pour mushaf_font, ce nombre reste le nombre de TTF attendus même si renderAssetPath ajoute un artefact JSON précompilé."
    },
    "license": {
      "type": "string",
      "minLength": 1,
      "description": "Licence textuelle du pack. Elle doit être juridiquement vérifiée et rattachée à la provenance de l'artefact précis ; la revue religieuse est une gate distincte."
    },
    "publicationStatus": {
      "type": "string",
      "description": "Statut de publication du manifest. Seul `active` est admissible à la signature ou à une release ; `quarantined` conserve une trace historique sans autoriser de redistribution.",
      "enum": ["active", "quarantined"]
    },
    "minAppVersion": {
      "type": "string",
      "description": "Version minimale d'app Flutter requise pour utiliser ce pack (MAJOR.MINOR.PATCH+BUILD).",
      "pattern": "^\\d+\\.\\d+\\.\\d+\\+\\d+$"
    },
    "transmission": {
      "type": "string",
      "description": "Transmission canonique du Coran (obligatoire pour les packs mushaf_font, audio_recitation, translation, tafsir, adhkar_audio liés au Coran). Doit être 'Hafs an Asim via al-Shatibiyya' pour cette version de l'app.",
      "enum": [
        "Hafs an Asim via al-Shatibiyya"
      ]
    },
    "layoutAssetPath": {
      "type": "string",
      "description": "Chemin de l'asset Flutter vers le layout SQLite associé (spécifique aux packs mushaf_font ; le layout est embarqué dans l'APK, le pack ne contient que les TTF).",
      "pattern": "^assets/.*\\.db$"
    },
    "fontNamePrefix": {
      "type": "string",
      "description": "Préfixe des fichiers TTF dans le ZIP (spécifique aux packs mushaf_font). Convention : <prefix><pageNumber>.ttf.",
      "pattern": "^[a-z_]+$"
    },
    "source": {
      "type": "object",
      "description": "Métadonnées de traçabilité de la source du pack (audit religieux et juridique).",
      "properties": {
        "qulId": {
          "type": [
            "integer",
            "null"
          ],
          "description": "ID de la ressource sur QUL Tarteel (qul.tarteel.ai) si applicable."
        },
        "qulPage": {
          "type": "string",
          "format": "uri",
          "description": "URL de la page QUL Tarteel correspondante."
        },
        "downloadDate": {
          "type": "string",
          "format": "date",
          "description": "Date ISO de téléchargement du contenu source (audit)."
        },
        "scholarlyValidation": {
          "type": "string",
          "description": "Référence à la validation talib-al-ilm (nom du savant, comité, ou note méthodologique)."
        },
        "note": {
          "type": "string",
          "description": "Note libre (ex: information manquante à compléter, contexte historique)."
        }
      }
    },
    "provenance": {
      "type": "object",
      "description": "Preuve de provenance, d'attribution et de droit de redistribution de l'artefact publié.",
      "required": [
        "sourceAuthority",
        "sourceUrl",
        "sourceVersion",
        "retrievedAt",
        "licenseUrl",
        "licenseSnapshotSha256",
        "attribution",
        "redistributionStatus"
      ],
      "properties": {
        "sourceAuthority": {"type": "string", "minLength": 1},
        "sourceUrl": {"type": "string", "format": "uri"},
        "sourceVersion": {"type": "string", "minLength": 1},
        "retrievedAt": {"type": "string", "format": "date"},
        "licenseUrl": {"type": "string", "format": "uri"},
        "licenseSnapshotSha256": {"type": "string", "pattern": "^[a-f0-9]{64}$"},
        "attribution": {"type": "string", "minLength": 1},
        "redistributionStatus": {"enum": ["allowed", "conditional"]}
      }
    },
    "renderAssetPath": {
      "type": "string",
      "description": "Chemin optionnel, dans le ZIP distant, vers un artefact de rendu Mushaf précompilé. Utilisé par les packs mushaf_font lourds pour éviter les lectures SQLite/script au swipe.",
      "pattern": "^render/[A-Za-z0-9._/-]+\\.json$"
    }
  },
  "definitions": {
    "trilingual": {
      "type": "object",
      "required": [
        "fr",
        "en",
        "ar"
      ],
      "description": "Champ trilingue obligatoire (français par défaut, anglais et arabe pour la Ummah).",
      "properties": {
        "fr": {
          "type": "string",
          "minLength": 1
        },
        "en": {
          "type": "string",
          "minLength": 1
        },
        "ar": {
          "type": "string",
          "minLength": 1
        }
      }
    }
  }
}
