{
  "$schema": "../../schemas/pack-manifest.schema.json",
  "id": "adhan_sounds_hq",
  "category": "prayer_audio",
  "version": "1.1.0",
  "displayName": {
    "fr": "Adhan - 12 muezzins",
    "en": "Adhan - 12 muezzins",
    "ar": "الأذان - 12 مؤذنا"
  },
  "description": {
    "fr": "Treize adhans par douze muezzins, courtoisie d'Assabile, avec pour chacun une amorce courte servant de son de notification.",
    "en": "Thirteen adhans by twelve muezzins, courtesy of Assabile, each with a short opening used as the notification sound.",
    "ar": "ثلاثة عشر أذانا لاثني عشر مؤذنا بإذن من أصبيل، مع مقطع افتتاحي قصير لكل منها يستخدم صوتا للتنبيه."
  },
  "url": "https://github.com/adisaf/deencoach-pack/releases/download/prayer-audio-v1.1.0/adhan_sounds_hq.zip",
  "artifactFormat": "zip",
  "contentType": "application/zip",
  "sizeCompressed": 11991667,
  "sizeUncompressed": 12833345,
  "sha256": "6f5ff6bb93788f0ebcb23ad5e6b6a2bce84ae1f47aea72717bcf6b825f9375a3",
  "fileCount": 40,
  "license": "Courtesy of Assabile (https://www.assabile.com). Attribution required, shipped as ATTRIBUTION.txt inside the archive.",
  "publicationStatus": "active",
  "minAppVersion": "1.2.3+17"
}
