{
  "$schema": "../../schemas/pack-manifest.schema.json",
  "id": "adhan_notification_sounds",
  "category": "prayer_audio",
  "version": "1.0.0",
  "displayName": {
    "fr": "Sons de notification de l'adhan",
    "en": "Adhan notification sounds",
    "ar": "أصوات تنبيه الأذان"
  },
  "description": {
    "fr": "Amorce courte de l'adhan pour chaque muezzin, aux deux formats exigés par iOS et Android.",
    "en": "A short adhan opening per muezzin, in the two formats iOS and Android require.",
    "ar": "مقطع افتتاحي قصير من الأذان لكل مؤذن، بالصيغتين اللتين يتطلبهما نظاما iOS و Android."
  },
  "url": "https://github.com/adisaf/deencoach-pack/releases/download/prayer-audio-v1.0.0/adhan_notification_sounds.zip",
  "artifactFormat": "zip",
  "contentType": "application/zip",
  "sizeCompressed": 3509983,
  "sizeUncompressed": 3995170,
  "sha256": "859c752fcccbdb01365387235ddc2a700f84af38cbf2353a635e3b4b897c5756",
  "fileCount": 27,
  "license": "Courtesy of Assabile (https://www.assabile.com). Attribution required, shipped as ATTRIBUTION.txt inside the archive.",
  "publicationStatus": "active",
  "minAppVersion": "1.2.3+17"
}
