{
  "$schema": "../../schemas/pack-manifest.schema.json",
  "id": "quran_text_simple_search",
  "category": "quran_text",
  "version": "1.0.0",
  "displayName": {
    "fr": "Texte coranique Simple Clean pour la recherche",
    "en": "Simple Clean Quran text for search",
    "ar": "نص القرآن المبسط للبحث"
  },
  "description": {
    "fr": "Copie verbatim Simple Clean Tanzil destinée à l'indexation et à la recherche.",
    "en": "Verbatim Tanzil Simple Clean text for indexing and search.",
    "ar": "نسخة حرفية من نص تنزيل المبسط للفهرسة والبحث."
  },
  "url": "https://github.com/adisaf/deencoach-pack/releases/download/quran-text-v1.0.0/quran-simple-clean.txt",
  "fallbackUrls": [
    "https://tanzil.net/pub/download/index.php?marks=false&sajdah=false&tatweel=false&quranType=simple-clean&outType=txt-2&agree=true"
  ],
  "artifactFormat": "raw",
  "contentType": "text/plain; charset=utf-8",
  "sizeCompressed": 794313,
  "sizeUncompressed": 794313,
  "sha256": "054b3d9f79c0c2e44df7f9ddf42561797b3b5cb4fbdafbf2e99c805ccf1a6b49",
  "fileCount": 1,
  "transmission": "Hafs an Asim via al-Shatibiyya",
  "license": "Tanzil Quran Text License, CC BY 3.0 with verbatim-copy conditions",
  "publicationStatus": "active",
  "minAppVersion": "1.0.1+10",
  "provenance": {
    "sourceAuthority": "Tanzil Project",
    "sourceUrl": "https://tanzil.net/pub/download/index.php?marks=false&sajdah=false&tatweel=false&quranType=simple-clean&outType=txt-2&agree=true",
    "sourceVersion": "1.1",
    "retrievedAt": "2026-07-13",
    "licenseUrl": "https://tanzil.net/docs/Text_License",
    "licenseSnapshotSha256": "665c0e48132115892b1ed4445903468b785917040d29802d750d0956a28a30f2",
    "attribution": "Tanzil Quran Text, Copyright (C) 2007-2021 Tanzil Project",
    "redistributionStatus": "allowed"
  }
}
